RFC,RAZÓN SOCIAL,TIPO PERSONA,SUPUESTO,FECHAS DE PRIMERA PUBLICACION,MONTO,Fecha de publicación (Con monto de acuerdo a la Ley de Transparencia
ANL0706256T1,ALFA NEW LIFE INTERNATIONAL SA DE CV,M,CONDONADOS,16/07/2016,16151425,15/07/2016
CAG850102GY5,CONSTRUCTORA LAS AGUILAS SA DE CV,M,CONDONADOS,16/07/2016,6812529,15/07/2016
CMR0406247U7,COMERCIALIZADORA MUNDO REWARDS SA DE CV,M,CONDONADOS,16/07/2016,4273754,15/07/2016
GSV0303143U6,GN + VIDA SA DE CV,M,CONDONADOS,16/07/2016,3845332,15/07/2016
HME98060141A,HERBAX DE MEXICO SA DE CV,M,CONDONADOS,16/07/2016,6347227,15/07/2016
MNS090123KD0,MAS NATURAL SALUD Y BIENESTAR S DE RL DE CV,M,CONDONADOS,16/03/2014,21895048,15/07/2016
TEL940531FV9,THYSSENKRUPP ELEVADORES SA DE CV,M,CONDONADOS,16/07/2016,9319180,15/07/2016
